{
  "$schema": "http://json-schema.org/draft-07/schema#",
  "$id": "https://rig-qa.local/schemas/review.schema.json",
  "type": "object",
  "additionalProperties": false,
  "required": [
    "schema_version",
    "asset_sha256",
    "report_sha256",
    "advice_sha256",
    "inspection",
    "ai_suggestions",
    "provider",
    "human_review",
    "limitation"
  ],
  "properties": {
    "schema_version": {
      "const": 1
    },
    "asset_sha256": {
      "type": "string",
      "pattern": "^[a-f0-9]{64}$"
    },
    "report_sha256": {
      "type": "string",
      "pattern": "^[a-f0-9]{64}$"
    },
    "advice_sha256": {
      "type": "string",
      "pattern": "^[a-f0-9]{64}$"
    },
    "inspection": {
      "$ref": "https://rig-qa.local/schemas/inspection.schema.json"
    },
    "ai_suggestions": {
      "$ref": "https://rig-qa.local/schemas/advice.schema.json"
    },
    "provider": {
      "type": "object",
      "additionalProperties": false,
      "required": [
        "mode",
        "provider",
        "model",
        "requested_at"
      ],
      "properties": {
        "mode": {
          "enum": [
            "mock",
            "live",
            "recorded"
          ]
        },
        "provider": {
          "enum": [
            "mock",
            "nebius"
          ]
        },
        "model": {
          "enum": [
            "none",
            "nvidia/NVIDIA-Nemotron-3-Nano-30B-A3B"
          ]
        },
        "response_model": {
          "const": "nvidia/NVIDIA-Nemotron-3-Nano-30B-A3B"
        },
        "requested_at": {
          "type": "string",
          "pattern": "^\\d{4}-\\d{2}-\\d{2}T\\d{2}:\\d{2}:\\d{2}\\.\\d{3}Z$"
        },
        "replayed_at": {
          "type": "string",
          "pattern": "^\\d{4}-\\d{2}-\\d{2}T\\d{2}:\\d{2}:\\d{2}\\.\\d{3}Z$"
        },
        "recording_evidence_sha256": {
          "type": "string",
          "pattern": "^[a-f0-9]{64}$"
        },
        "usage": {
          "type": "object",
          "additionalProperties": false,
          "properties": {
            "prompt_tokens": {
              "type": "integer",
              "minimum": 0,
              "maximum": 10000000
            },
            "completion_tokens": {
              "type": "integer",
              "minimum": 0,
              "maximum": 10000000
            },
            "total_tokens": {
              "type": "integer",
              "minimum": 0,
              "maximum": 10000000
            }
          }
        }
      },
      "allOf": [
        {
          "if": {
            "properties": {
              "mode": {
                "const": "mock"
              }
            }
          },
          "then": {
            "properties": {
              "provider": {
                "const": "mock"
              },
              "model": {
                "const": "none"
              },
              "response_model": false
            }
          }
        },
        {
          "if": {
            "properties": {
              "mode": {
                "const": "live"
              }
            }
          },
          "then": {
            "required": [
              "response_model"
            ],
            "properties": {
              "provider": {
                "const": "nebius"
              },
              "model": {
                "const": "nvidia/NVIDIA-Nemotron-3-Nano-30B-A3B"
              },
              "response_model": {
                "const": "nvidia/NVIDIA-Nemotron-3-Nano-30B-A3B"
              }
            }
          }
        },
        {
          "if": {
            "properties": {
              "mode": {
                "const": "recorded"
              }
            }
          },
          "then": {
            "required": [
              "response_model",
              "replayed_at",
              "recording_evidence_sha256"
            ],
            "properties": {
              "provider": {
                "const": "nebius"
              },
              "model": {
                "const": "nvidia/NVIDIA-Nemotron-3-Nano-30B-A3B"
              },
              "response_model": {
                "const": "nvidia/NVIDIA-Nemotron-3-Nano-30B-A3B"
              },
              "replayed_at": {
                "type": "string",
                "pattern": "^\\d{4}-\\d{2}-\\d{2}T\\d{2}:\\d{2}:\\d{2}\\.\\d{3}Z$"
              },
              "recording_evidence_sha256": {
                "type": "string",
                "pattern": "^[a-f0-9]{64}$"
              }
            }
          }
        },
        {
          "if": {
            "properties": {
              "mode": {
                "enum": [
                  "mock",
                  "live"
                ]
              }
            }
          },
          "then": {
            "properties": {
              "replayed_at": false,
              "recording_evidence_sha256": false
            }
          }
        }
      ]
    },
    "human_review": {
      "type": "object",
      "additionalProperties": false,
      "required": [
        "reviewed_at",
        "decisions",
        "repair_approved"
      ],
      "properties": {
        "reviewed_at": {
          "type": "string",
          "pattern": "^\\d{4}-\\d{2}-\\d{2}T\\d{2}:\\d{2}:\\d{2}\\.\\d{3}Z$"
        },
        "repair_approved": {
          "const": false
        },
        "decisions": {
          "type": "array",
          "maxItems": 32,
          "items": {
            "type": "object",
            "additionalProperties": false,
            "required": [
              "recommendation_id",
              "decision"
            ],
            "properties": {
              "recommendation_id": {
                "type": "string",
                "pattern": "^R[0-9]{4}$"
              },
              "decision": {
                "enum": [
                  "accept",
                  "defer",
                  "reject"
                ]
              }
            }
          }
        }
      }
    },
    "limitation": {
      "type": "string",
      "maxLength": 400
    }
  }
}
